{
  "$schema": "https://json-schema.org/draft/2020-12/schema",
  "$id": "https://example.invalid/ofscp/schemas/v0.1/discoverable-delivery.json",
  "title": "OFSCP Discoverable Feed Delivery (push) (v0.1)",
  "description": "A fat feed push from the hub to a subscriber's callback (§8.4). Provider-signed (§8.1): the HTTP request carries provider-signing headers, and the embedded `provider`/`signature` fields make the stored payload verifiable independent of transport (mirroring §10). Subscribers dedupe by message id (§7.1) and apply created/updated/deleted by id.",
  "type": "object",
  "additionalProperties": true,
  "required": ["topic", "groupId", "channelId", "events", "provider", "signature"],
  "properties": {
    "topic": {
      "$ref": "./defs/common.json#/$defs/HttpsUri",
      "description": "The discoverable feed URL this delivery belongs to."
    },
    "groupId": { "type": "string", "minLength": 1 },
    "channelId": { "type": "string", "minLength": 1 },
    "events": {
      "type": "array",
      "minItems": 1,
      "items": {
        "type": "object",
        "additionalProperties": true,
        "required": ["kind", "message"],
        "properties": {
          "kind": {
            "type": "string",
            "enum": ["created", "updated", "deleted"],
            "description": "`created`/`updated` carry the full message; `deleted` carries a tombstone (id + deletedAt, content cleared)."
          },
          "cursor": {
            "$ref": "./defs/common.json#/$defs/OpaqueCursor",
            "description": "Position of this event in the feed timeline (same cursor space as GET .../discoverable)."
          },
          "message": {
            "type": "object",
            "additionalProperties": true,
            "required": ["id"],
            "description": "Full message (§5.3) for created/updated; a tombstone { id, deletedAt } for deleted.",
            "properties": {
              "id": { "type": "string", "minLength": 1 },
              "author": { "$ref": "./defs/identity.json#/$defs/UserRef" },
              "createdAt": { "$ref": "./defs/common.json#/$defs/Rfc3339DateTime" },
              "editedAt": { "$ref": "./defs/common.json#/$defs/Rfc3339DateTime" },
              "deletedAt": { "$ref": "./defs/common.json#/$defs/Rfc3339DateTime" },
              "content": { "$ref": "./defs/messaging.json#/$defs/Content" }
            }
          }
        }
      }
    },
    "provider": {
      "type": "string",
      "minLength": 1,
      "description": "Domain of the signing (hub) provider; verified against its provider.publicKeys (§3.1, §8.1)."
    },
    "signature": {
      "type": "string",
      "minLength": 1,
      "description": "Detached Ed25519 signature (base64) over the canonical delivery payload."
    }
  }
}
